{
  "server": "datasheet",
  "compliance": [
    {
      "id": "C01",
      "status": "met"
    },
    {
      "id": "C02",
      "status": "met"
    },
    {
      "id": "C03",
      "status": "met"
    },
    {
      "id": "C04",
      "status": "met",
      "note": "report and usage catalogs use SQL-selected pages; discovery lists roots and templates"
    },
    {
      "id": "C05",
      "status": "met"
    },
    {
      "id": "C06",
      "status": "met"
    },
    {
      "id": "C07",
      "status": "met"
    },
    {
      "id": "C08",
      "status": "met"
    },
    {
      "id": "C09",
      "status": "met"
    },
    {
      "id": "C10",
      "status": "met"
    },
    {
      "id": "C11",
      "status": "met"
    },
    {
      "id": "C12",
      "status": "met"
    },
    {
      "id": "C13",
      "status": "met"
    },
    {
      "id": "C14",
      "status": "met"
    },
    {
      "id": "C15",
      "status": "met"
    },
    {
      "id": "C16",
      "status": "met"
    },
    {
      "id": "C17",
      "status": "met",
      "note": "local and reference gateway registrations declare contract revision 4"
    },
    {
      "id": "C18",
      "status": "met"
    },
    {
      "id": "C19",
      "status": "met"
    },
    {
      "id": "C20",
      "status": "met"
    },
    {
      "id": "C21",
      "status": "met"
    },
    {
      "id": "C22",
      "status": "met"
    },
    {
      "id": "C23",
      "status": "met"
    },
    {
      "id": "C24",
      "status": "met"
    },
    {
      "id": "C25",
      "status": "met"
    },
    {
      "id": "C26",
      "status": "met"
    },
    {
      "id": "C27",
      "status": "met",
      "note": "Task subscriptions select current owner-authorized state in SQL and close their LIVE reader with the request"
    },
    {
      "id": "C28",
      "status": "met"
    },
    {
      "id": "C29",
      "status": "met"
    },
    {
      "id": "C30",
      "status": "met",
      "note": "the server is stateless at the MCP boundary and retains only explicit durable domain state"
    },
    {
      "id": "C31",
      "status": "met",
      "note": "installed Discover, list surfaces and readiness pass hosted certification"
    },
    {
      "id": "C32",
      "status": "pending",
      "note": "typed docs observations and build digests are wired; installed K01–K08 qualification remains"
    },
    {
      "id": "C33",
      "status": "pending",
      "note": "Owner camelCase schemas, tool/resource/Task producers, Workbench receiver and version-2 cursors are qualified locally; installed qualification remains pending."
    }
  ],
  "contractRevision": 4,
  "catalogRevision": 2
}
